{
  "schema_version": "1.0",
  "message_type": "capabilities",
  "message_id": "CWS-TEST-0123456789abcdef-1",
  "device_id": "CWS-TEST",
  "boot_id": "0123456789abcdef",
  "sequence": 1,
  "time": {
    "uptime_ms": 2500,
    "synchronized": false,
    "unix_s": null
  },
  "capabilities": {
    "commands": [
      "device.get_info",
      "device.get_status",
      "device.get_health",
      "device.get_capabilities",
      "device.reboot",
      "device.factory_reset",
      "device.clear_recoverable_faults",
      "device.get_diagnostics",
      "device.sync_time",
      "config.get",
      "config.validate",
      "config.patch",
      "config.restore_defaults",
      "config.get_revision",
      "config.export",
      "environment.read_now",
      "environment.get_status",
      "soil.read_now",
      "soil.get_status",
      "battery.read_now",
      "battery.get_status",
      "solar.read_now",
      "solar.get_status",
      "lcd.get_status",
      "lcd.set_backlight",
      "lcd.set_timeout",
      "lcd.set_page",
      "lcd.set_enabled",
      "lcd.show_notice",
      "led.get_status",
      "led.set_enabled",
      "led.set_preferences",
      "led.test",
      "led.reset_preferences",
      "buzzer.get_status",
      "buzzer.set_enabled",
      "buzzer.set_alert_preferences",
      "buzzer.mute",
      "buzzer.unmute",
      "buzzer.test",
      "buzzer.stop",
      "wifi.get_status",
      "wifi.scan",
      "wifi.configure",
      "wifi.test_connection",
      "wifi.reconnect",
      "wifi.disconnect",
      "wifi.forget_network",
      "mqtt.get_status",
      "mqtt.configure",
      "mqtt.test_connection",
      "mqtt.reconnect",
      "mqtt.get_config",
      "telemetry.read_now",
      "telemetry.get_last",
      "telemetry.get_history",
      "telemetry.publish_now",
      "telemetry.set_intervals",
      "telemetry.get_delivery_status",
      "telemetry.retry_pending",
      "storage.get_status",
      "storage.get_statistics",
      "storage.get_pending_count",
      "storage.export_records",
      "storage.retry_sync",
      "storage.set_retention",
      "storage.purge_acknowledged",
      "diagnostics.get_faults",
      "diagnostics.get_logs",
      "diagnostics.self_test",
      "diagnostics.get_memory",
      "diagnostics.get_reset_reason",
      "firmware.get_version",
      "firmware.get_update_status"
    ],
    "command_authorization": "TLS broker identity and per-device ACL",
    "mutations_require_expected_revision": true,
    "max_command_lifetime_s": 300,
    "headless": true,
    "lcd_present": false,
    "encoder_enabled": false,
    "tls_required": true,
    "mqtt_qos": 1,
    "durable_ack_enabled": false,
    "ota": false,
    "vwc": false,
    "battery_percentage": false,
    "mtls": false,
    "max_message_bytes": 8192,
    "max_history_records_per_response": 1
  }
}
